difficulty	preference	context	aspect	direct	opinion	argument	reason	method	factoid	super	comp	question	item1	item2	item3	comp_aspect1	comp_aspect2	non-serious	navigational	spelling	rude	not question	dataset
0	0	0	0	0	0	0	0	0	0	0	0	how do you download text messages from iphone to computer	0	0	0	0	0	0	0	0	0	0	m
0	0	0	0	0	0	0	0	0	0	0	0	what does the name ronnie mean?	0	0	0	0	0	0	0	0	0	0	m
0	0	0	0	0	0	0	0	0	0	0	0	how long is oj sentenced to	0	0	0	0	0	0	0	0	0	0	m
0	0	0	0	0	0	0	0	0	0	0	0	what is fakers salary	0	0	0	0	0	0	0	0	0	0	m
0	0	0	0	0	0	0	0	0	0	0	0	causes for anemia in men	0	0	0	0	0	0	0	0	0	1	m
0	0	0	0	0	0	0	0	0	0	0	0	where is hays county	0	0	0	0	0	0	0	0	0	0	m
0	0	0	0	0	0	0	0	0	0	0	0	what does a captain of a ship do	0	0	0	0	0	0	0	0	0	0	m
0	0	0	0	0	0	0	0	0	0	0	0	what is ethiopian opal	0	0	0	0	0	0	0	0	0	0	m
0	0	0	0	0	0	0	0	0	0	0	0	why is interpersonal skills important when hosting an event?	0	0	0	0	0	0	0	0	0	0	m
0	0	0	0	0	0	0	0	0	0	0	0	cost of an ireland vacation	0	0	0	0	0	0	0	0	0	1	m
0	0	0	0	0	0	0	0	0	0	0	0	vitamins and minerals for stomach	0	0	0	0	0	0	0	0	0	0	m
0	0	0	0	0	0	0	0	0	0	0	0	what side effects when you stop taking diovan	0	0	0	0	0	0	0	0	0	0	m
0	0	0	0	0	0	0	0	0	0	0	0	what letter is zero	0	0	0	0	0	0	0	0	0	0	m
0	0	0	0	0	0	0	0	0	0	0	0	what is evidence discovery	0	0	0	0	0	0	0	0	0	0	m
0	0	0	0	0	0	0	0	0	0	0	0	what is philadelphia minimum wage	0	0	0	0	0	0	0	0	0	0	m
0	0	0	0	0	0	0	0	0	0	0	0	how long can marinara sauce stay in fridge	0	0	0	0	0	0	0	0	0	0	m
0	0	0	0	0	0	0	0	0	0	0	0	what is a brand for a destination?	0	0	0	0	0	0	0	0	0	0	m
0	0	0	0	0	0	0	0	0	0	0	0	cost to have whole house generator installed	0	0	0	0	0	0	0	0	0	1	m
0	0	0	0	0	0	0	0	0	0	0	0	what enzyme unzips dna	0	0	0	0	0	0	0	0	0	0	m
0	0	0	0	0	0	0	0	0	0	0	0	what is the goal of plants	0	0	0	0	0	0	0	0	0	0	m
0	0	0	0	0	0	0	0	0	0	0	0	average renovation cost	0	0	0	0	0	0	0	0	0	1	m
0	0	0	0	0	0	0	0	0	0	0	0	what are causes of yeast infections	0	0	0	0	0	0	0	0	0	0	m
0	0	0	0	0	0	0	0	0	0	0	0	what is a viable gestational age	0	0	0	0	0	0	0	0	0	0	m
0	0	0	0	0	0	0	0	0	0	0	0	lake erie water quality advisory aug 17	0	0	0	0	0	0	0	0	0	0	m
0	0	0	0	0	0	0	0	0	0	0	0	what is a vector version of a logo	0	0	0	0	0	0	0	0	0	0	m
0	0	0	0	0	0	0	0	0	0	0	0	health care is a right not a privilege	0	0	0	0	0	0	0	0	0	0	m
0	0	0	0	0	0	0	0	0	0	0	0	gutenberg is credited with creating the first font type for mass printing called _______.	0	0	0	0	0	0	0	0	0	1	m
0	0	0	0	0	0	0	0	0	0	0	0	how many days after hcg shot pregnancy test	0	0	0	0	0	0	0	0	0	0	m
0	0	0	0	0	0	0	0	0	0	0	0	what is the atkins and zone diet	0	0	0	0	0	0	0	0	0	0	m
0	0	0	0	0	0	0	0	0	0	0	0	are cpa accountants insured	0	0	0	0	0	0	0	0	0	0	m
0	0	0	0	0	0	0	0	0	0	0	0	credit unions in raleigh nc	0	0	0	0	0	0	0	0	0	1	m
0	0	0	0	0	0	0	0	0	0	0	0	what font is the mlb yankees numbers	0	0	0	0	0	0	0	0	0	0	m
0	0	0	0	0	0	0	0	0	0	0	0	where is nashville tn located	0	0	0	0	0	0	0	0	0	0	m
0	0	0	0	0	0	0	0	0	0	0	0	causes for pain on right side of spine	0	0	0	0	0	0	0	0	0	0	m
0	0	0	0	0	0	0	0	0	0	0	0	the origin of native american myths	0	0	0	0	0	0	0	0	0	0	m
0	0	0	0	0	0	0	0	0	0	0	0	can elbow pain be caused by shoulder	0	0	0	0	0	0	0	0	0	0	m
0	0	0	0	0	0	0	0	0	0	0	0	what does the poppy mean	0	0	0	0	0	0	0	0	0	0	m
0	0	0	0	0	0	0	0	0	0	0	0	average march temperatures in morzine france	0	0	0	0	0	0	0	0	0	0	m
0	0	0	0	0	0	0	0	0	0	0	0	what does osb stand for	0	0	0	0	0	0	0	0	0	0	m
0	0	0	0	0	0	0	0	0	0	0	0	what are quality braided rugs made of	0	0	0	0	0	0	0	0	0	0	m
0	0	0	0	0	0	0	0	0	0	0	0	casts in urine on ua	0	0	0	0	0	0	0	0	0	0	m
0	0	0	0	0	0	0	0	0	0	0	0	what are votive statues	0	0	0	0	0	0	0	0	0	0	m
0	0	0	0	0	0	0	0	0	0	0	0	thought partner meaning insurance	0	0	0	0	0	0	0	0	0	0	m
0	0	0	0	0	0	0	0	0	0	0	0	what is a bio ethanol fireplace	0	0	0	0	0	0	0	0	0	0	m
0	0	0	0	0	0	0	0	0	0	0	0	what time do doors open at nationals park	0	0	0	0	0	0	0	0	0	0	m
0	0	0	0	0	0	0	0	0	0	0	0	what is formed when reverse transcriptase is used on a strand of mrna	0	0	0	0	0	0	0	0	0	0	m
0	0	0	0	0	0	0	0	0	0	0	0	Pure Food and Drug Act definition	0	0	0	0	0	0	0	0	0	0	m
0	0	0	0	0	0	0	0	0	0	0	0	who is the children news?	0	0	0	0	0	0	0	0	0	0	m
0	0	0	0	0	0	0	0	0	0	0	0	watterson towers	0	0	0	0	0	0	0	0	0	1	m
0	0	0	0	0	0	0	0	0	0	0	0	what nationality is luckinbill	0	0	0	0	0	0	0	0	0	0	m
0	0	0	0	0	0	0	0	0	0	0	0	target tissue definition	0	0	0	0	0	0	0	0	0	1	m
0	0	0	0	0	0	0	0	0	0	0	0	what is a residential cooling tower	0	0	0	0	0	0	0	0	0	0	m
0	0	0	0	0	0	0	0	0	0	0	0	define gfsi	0	0	0	0	0	0	0	0	0	1	m
0	0	0	0	0	0	0	0	0	0	0	0	at what point does earned income become taxable	0	0	0	0	0	0	0	0	0	0	m
0	0	0	0	0	0	0	0	0	0	0	0	average radon levels in homes	0	0	0	0	0	0	0	0	0	0	m
0	0	0	0	0	0	0	0	0	0	0	0	What is it like being muslim in mississippi?	0	0	0	0	0	0	0	0	0	0	m
0	0	0	0	0	0	0	0	0	0	0	0	what laboratory makes lisinopril	0	0	0	0	0	0	0	0	0	0	m
0	0	0	0	0	0	0	0	0	0	0	0	how long will cooked shrimp stay good in fridge?	0	0	0	0	0	0	0	0	0	0	m
0	0	0	0	0	0	0	0	0	0	0	0	how long refund back to card	0	0	0	0	0	0	0	0	0	0	m
0	0	0	0	0	0	0	0	0	0	0	0	is the calla lily poisonous	0	0	0	0	0	0	0	0	0	0	m
0	0	0	0	0	0	0	0	0	0	0	0	when do clocks go forward in the uk?	0	0	0	0	0	0	0	0	0	0	m
0	0	0	0	0	0	0	0	0	0	0	0	what is the definition of obliteration	0	0	0	0	0	0	0	0	0	0	m
0	0	0	0	0	0	0	0	0	0	0	0	how to use mla heading	0	0	0	0	0	0	0	0	0	0	m
0	0	0	0	0	0	0	0	0	0	0	0	how long does hepatitis a & b vaccine last?	0	0	0	0	0	0	0	0	0	0	m
0	0	0	0	0	0	0	0	0	0	0	0	what game is quidditch?	0	0	0	0	0	0	0	0	0	0	m
0	0	0	0	0	0	0	0	0	0	0	0	origin of tellurium name	0	0	0	0	0	0	0	0	0	1	m
0	0	0	0	0	0	0	0	0	0	0	0	what type of animal is otis off cbeebies	0	0	0	0	0	0	0	0	0	0	m
0	0	0	0	0	0	0	0	0	0	0	0	what genre is electric guests	0	0	0	0	0	0	0	0	0	0	m
0	0	0	0	0	0	0	0	0	0	0	0	what is the purple flower	0	0	0	0	0	0	0	0	0	0	m
0	0	0	0	0	0	0	0	0	0	0	0	what causes polyps in stomach?	0	0	0	0	0	0	0	0	0	0	m
0	0	0	0	0	0	0	0	0	0	0	0	define: forensic	0	0	0	0	0	0	0	0	0	1	m
0	0	0	0	0	0	0	0	0	0	0	0	legal basis definition	0	0	0	0	0	0	0	0	0	0	m
0	0	0	0	0	0	0	0	0	0	0	0	what is blue apron delivery	0	0	0	0	0	0	0	0	0	0	m
0	0	0	0	0	0	0	0	0	0	0	0	expiring premium definition	0	0	0	0	0	0	0	0	0	1	m
0	0	0	0	0	0	0	0	0	0	0	0	how many days in a venus year	0	0	0	0	0	0	0	0	0	0	m
0	0	0	0	0	0	0	0	0	0	0	0	how did the civil war influence the role of government in the united states	0	0	0	0	0	0	0	0	0	0	m
0	0	0	0	0	0	0	0	0	0	0	0	what vit is sulfur	0	0	0	0	0	0	0	0	0	0	m
0	0	0	0	0	0	0	0	0	0	0	0	symptoms of bronchitis and pneumonia	0	0	0	0	0	0	0	0	0	1	m
0	0	0	0	0	0	0	0	0	0	0	0	where is eleuthera?	0	0	0	0	0	0	0	0	0	0	m
0	0	0	0	0	0	0	0	0	0	0	0	what is city center in tokyo	0	0	0	0	0	0	0	0	0	0	m
0	0	0	0	0	0	0	0	0	0	0	0	can do attitude synonym	0	0	0	0	0	0	0	0	0	0	m
0	0	0	0	0	0	0	0	0	0	0	0	how many students at la trade tech	0	0	0	0	0	0	0	0	0	0	m
0	0	0	0	0	0	0	0	0	0	0	0	what kinds of pigments in chloroplast	0	0	0	0	0	0	0	0	0	0	m
0	0	0	0	0	0	0	0	0	0	0	0	interview question how to do you take crisitiszm for the boss	0	0	0	0	0	0	0	0	0	0	m
0	0	0	0	0	0	0	0	0	0	0	0	what the legal age teen can start taking their own medication	0	0	0	0	0	0	0	0	0	0	m
0	0	0	0	0	0	0	0	0	0	0	0	how do you know if your shoulder is broken	0	0	0	0	0	0	0	0	0	0	m
0	0	0	0	0	0	0	0	0	0	0	0	what accreditation do you need to be a nail salon technician	0	0	0	0	0	0	0	0	0	0	m
0	0	0	0	0	0	0	0	0	0	0	0	what is seven in greek	0	0	0	0	0	0	0	0	0	0	m
0	0	0	0	0	0	0	0	0	0	0	0	what was the bourgeoisie	0	0	0	0	0	0	0	0	0	0	m
0	0	0	0	0	0	0	0	0	0	0	0	what county is malden mo in	0	0	0	0	0	0	0	0	0	0	m
0	0	0	0	0	0	0	0	0	0	0	0	why do they do para olimpics	0	0	0	0	0	0	0	0	0	0	m
0	0	0	0	0	0	0	0	0	0	0	0	warfarin cost per month	0	0	0	0	0	0	0	0	0	0	m
0	0	0	0	0	0	0	0	0	0	0	0	who became president of the constitutional convention	0	0	0	0	0	0	0	0	0	0	m
0	0	0	0	0	0	0	0	0	0	0	0	what is sap data entry	0	0	0	0	0	0	0	0	0	0	m
0	0	0	0	0	0	0	0	0	0	0	0	medical coding how many days is considered acute?	0	0	0	0	0	0	0	0	0	0	m
0	0	0	0	0	0	0	0	0	0	0	0	what happens when your reported on facebook	0	0	0	0	0	0	0	0	0	0	m
0	0	0	0	0	0	0	0	0	0	0	0	is elliptical good for knees	0	0	0	0	0	0	0	0	0	0	m
0	0	0	0	0	0	0	0	0	0	0	0	can you use potato flour in place of almond flour	0	0	0	0	0	0	0	0	0	0	m
0	0	0	0	0	0	0	0	0	0	0	0	definition of coeur	0	0	0	0	0	0	0	0	0	1	m
0	0	0	0	0	0	0	0	0	0	0	0	when was the first digimon game made	0	0	0	0	0	0	0	0	0	0	m
0	0	0	0	0	0	0	0	0	0	0	0	what time ikea closes	0	0	0	0	0	0	0	0	0	0	m
0	0	0	0	0	0	0	0	0	0	0	0	why do step siblings bully	0	0	0	0	0	0	0	0	0	0	m
0	0	0	0	0	0	0	0	0	0	0	0	Eric Melvin Wife	0	0	0	0	0	0	0	0	0	1	m
0	0	0	0	0	0	0	0	0	0	0	0	how many sections does a symphonic orchestra have?	0	0	0	0	0	0	0	0	0	0	m
0	0	0	0	0	0	0	0	0	0	0	0	what kind of veggie is cape cassava	0	0	0	0	0	0	0	0	0	0	m
0	0	0	0	0	0	0	0	0	0	0	0	reason behind muslim terrorism	0	0	0	0	0	0	0	0	0	1	m
0	0	0	0	0	0	0	0	0	0	0	0	what type of cholesterol is in yogurt	0	0	0	0	0	0	0	0	0	0	m
0	0	0	0	0	0	0	0	0	0	0	1	which state produce most wheat	0	0	0	0	0	0	0	0	0	0	m
0	0	0	0	0	0	0	0	0	0	0	0	executive vice president of membership job description	0	0	0	0	0	0	0	0	0	1	m
0	0	0	0	0	0	0	0	0	0	0	0	what is an arq transmission system	0	0	0	0	0	0	0	0	0	0	m
0	0	0	0	0	0	0	0	0	0	0	0	whats degree do mean	0	0	0	0	0	0	0	0	0	0	m
0	0	0	0	0	0	0	0	0	0	0	0	what are the causative organisms for gonorrhea	0	0	0	0	0	0	0	0	0	0	m
0	0	0	0	0	0	0	0	0	0	0	0	learning arabic	0	0	0	0	0	0	0	0	0	1	m
0	0	0	0	0	0	0	0	0	0	0	0	what is tops ships inc	0	0	0	0	0	0	0	0	0	0	m
0	0	0	0	0	0	0	0	0	0	0	0	how many tablespoons for an eight of a cup	0	0	0	0	0	0	0	0	0	0	m
0	0	0	0	0	0	0	0	0	0	0	0	issue date what was it or what did it do who saw it as a threat the north the south or both how did it threaten them	0	0	0	0	0	0	0	0	0	0	m
0	0	0	0	0	0	0	0	0	0	0	0	chevy sonic crack oil pan replacment cost	0	0	0	0	0	0	0	0	0	1	m
0	0	0	0	0	0	0	0	0	0	0	0	where is swedish hospital colorado	0	0	0	0	0	0	0	0	0	0	m
0	0	0	0	0	0	0	0	0	0	0	0	what do compilers do	0	0	0	0	0	0	0	0	0	0	m
0	0	0	0	0	0	0	0	0	0	0	0	what company took over rockford life insurance company	0	0	0	0	0	0	0	0	0	0	m
0	0	0	0	0	0	0	0	0	0	0	0	does seltzer water help with heartburn	0	0	0	0	0	0	0	0	0	0	m
0	0	0	0	0	0	0	0	0	0	0	0	shall we date blood in roses alfred walkthrough	0	0	0	0	0	0	0	0	0	1	m
0	0	0	0	0	0	0	0	0	0	0	0	where is villareggia	0	0	0	0	0	0	0	0	0	0	m
0	0	0	0	0	0	0	0	0	0	0	1	what planets are larger than mercury	0	0	0	0	0	0	0	0	0	0	m
0	0	0	0	0	0	0	0	0	0	0	0	describe how organisms are organized	0	0	0	0	0	0	0	0	0	1	m
0	0	0	0	0	0	0	0	0	0	0	0	css code to change font colors	0	0	0	0	0	0	0	0	0	1	m
0	0	0	0	0	0	0	0	0	0	0	0	where is armour yards in atlanta ga.	0	0	0	0	0	0	0	0	0	0	m
0	0	0	0	0	0	0	0	0	0	0	0	what dosage of cytomel for weight loss	0	0	0	0	0	0	0	0	0	0	m
0	0	0	0	0	0	0	0	0	0	0	0	what is marketing planning	0	0	0	0	0	0	0	0	0	0	m
0	0	0	0	0	0	0	0	0	0	0	0	cummins diesel cost	0	0	0	0	0	0	0	0	0	1	m
0	0	0	0	0	0	0	0	0	0	0	0	what is hemp used for is hemp protein legal in the us is infused	0	0	0	0	0	0	0	0	0	0	m
0	0	0	0	0	0	0	0	0	0	0	0	type of terrain in afghanistan	0	0	0	0	0	0	0	0	0	1	m
0	0	0	0	0	0	0	0	0	0	0	0	what stores carry unique natural rv toilet bowl cleaner	0	0	0	0	0	0	0	0	0	0	m
0	0	0	0	0	0	0	0	0	0	0	0	eversource nh phone number	0	0	0	0	0	0	0	0	0	1	m
0	0	0	0	0	0	0	0	0	0	0	0	how to use essential oils to lower cholesterol	0	0	0	0	0	0	0	0	0	0	m
0	0	0	0	0	0	0	0	0	0	0	0	what causes warts on cattle	0	0	0	0	0	0	0	0	0	0	m
0	0	0	0	0	0	0	0	0	0	0	0	what is required in a good supervisor?	0	0	0	0	0	0	0	0	0	0	m
0	0	0	0	0	0	0	0	0	0	0	0	do parakeets understand when you talk to them	0	0	0	0	0	0	0	0	0	1	m
0	0	0	0	0	0	0	0	0	0	0	0	roof top tent arb	0	0	0	0	0	0	0	0	0	1	m
0	0	0	0	0	0	0	0	0	0	0	0	what is the agenda of skywatch	0	0	0	0	0	0	0	0	0	0	m
0	0	0	0	0	0	0	0	0	0	0	0	distance north platte ne to omaha ne	0	0	0	0	0	0	0	0	0	1	m
0	0	0	0	0	0	0	0	0	0	0	0	can alcohol aggravate arthritis	0	0	0	0	0	0	0	0	0	0	m
0	0	0	0	0	0	0	0	0	0	0	0	listeriosis symptoms in adults	0	0	0	0	0	0	0	0	0	1	m
0	0	0	0	0	0	0	0	0	0	0	0	what county is buckhannon wv in	0	0	0	0	0	0	0	0	0	0	m
0	0	0	0	0	0	0	0	0	0	0	0	what county is flagstaff, az in	0	0	0	0	0	0	0	0	0	0	m
0	0	0	0	0	0	0	0	0	0	0	0	what does dna provide the code for? brainly	0	0	0	0	0	0	0	0	0	0	m
0	0	0	0	0	0	0	0	0	0	0	0	does football cause bad behavior for young children	0	0	0	0	0	0	0	0	0	0	m
0	0	0	0	0	0	0	0	0	0	0	0	how to redeem american airlines credit	0	0	0	0	0	0	0	0	0	0	m
0	0	0	0	0	0	0	0	0	0	0	0	power factor definition	0	0	0	0	0	0	0	0	0	1	m
0	0	0	0	0	0	0	0	0	0	0	1	which fireside poet is considered the most influential writer connected to the abolitionist movement?	0	0	0	0	0	0	0	0	0	0	m
0	0	0	0	0	0	0	0	0	0	0	0	world health organization definition of self harm	0	0	0	0	0	0	0	0	0	1	m
0	0	0	0	0	0	0	0	0	0	0	0	where is notre dame france	0	0	0	0	0	0	0	0	0	0	m
0	0	0	0	0	0	0	0	0	0	0	0	how long does a suspended license stay on your record after its been reinstated	0	0	0	0	0	0	0	0	0	0	m
0	0	0	0	0	0	0	0	0	0	0	0	which drugs are effective against staphylococcus aureus?	0	0	0	0	0	0	0	0	0	0	m
0	0	0	0	0	0	0	0	0	0	0	1	which summertimes smell cream creates a most pleasant memories	0	0	0	0	0	0	0	0	0	0	m
0	0	0	0	0	0	0	0	0	0	0	0	m- how do i connect to a wireless pc	0	0	0	0	0	0	0	0	0	0	m
0	0	0	0	0	0	0	0	0	0	0	0	phone number for cobb county water system	0	0	0	0	0	0	0	0	0	1	m
0	0	0	0	0	0	0	0	0	0	0	0	types of neurocognitive testing	0	0	0	0	0	0	0	0	0	1	m
0	0	0	0	0	0	0	0	0	0	0	0	what does gr mean for in landscaping	0	0	0	0	0	0	0	0	0	0	m
0	0	0	0	0	0	0	0	0	0	0	0	afb t routing number	0	0	0	0	0	0	0	0	0	1	m
0	0	0	0	0	0	0	0	0	0	0	0	which chemical symbol represents a metallic element?	0	0	0	0	0	0	0	0	0	0	m
0	0	0	0	0	0	0	0	0	0	0	0	how to make an adjustable bow tie	0	0	0	0	0	0	0	0	0	0	m
0	0	0	0	0	0	0	0	0	0	0	0	what cell structure produces mitotic spindles	0	0	0	0	0	0	0	0	0	0	m
0	0	0	0	0	0	0	0	0	0	0	0	what happens when the bees die	0	0	0	0	0	0	0	0	0	0	m
0	0	0	0	0	0	0	0	0	0	0	1	what is the difference between alcohol and hydrogen peroxide	0	0	0	0	0	0	0	0	0	0	m
0	0	0	0	0	0	0	0	0	0	0	0	do physicians pay for insurance from their salaries?	0	0	0	0	0	0	0	0	0	0	m
0	0	0	0	0	0	0	0	0	0	0	0	how legit is credit karma	0	0	0	0	0	0	0	0	0	0	m
0	0	0	0	0	0	0	0	0	0	0	0	what are direct marketing tactics	0	0	0	0	0	0	0	0	0	0	m
0	0	0	0	0	0	0	0	0	0	0	0	distance baton rouge to galveston tx	0	0	0	0	0	0	0	0	0	0	m
0	0	0	0	0	0	0	0	0	0	0	0	can statins cause tongue swelling	0	0	0	0	0	0	0	0	0	0	m
0	0	0	0	0	0	0	0	0	0	0	0	largest dam in asia	0	0	0	0	0	0	0	0	0	1	m
0	0	0	0	0	0	0	0	0	0	0	0	how long does it take to close on a refinance	0	0	0	0	0	0	0	0	0	0	m
0	0	0	0	0	0	0	0	0	0	0	1	who who is the tallest woman in the world	0	0	0	0	0	0	0	0	0	0	m
0	0	0	0	0	0	0	0	0	0	0	0	according to Kohlberg most adolescents are in what stage of moral development	0	0	0	0	0	0	0	0	0	1	m
0	0	0	0	0	0	0	0	0	0	0	0	what does fiat mistura mean	0	0	0	0	0	0	0	0	0	0	m
0	0	0	0	0	0	0	0	0	0	0	0	average weather for panama city fl	0	0	0	0	0	0	0	0	0	1	m
0	0	0	0	0	0	0	0	0	0	0	0	are leather gloves heat resistant	0	0	0	0	0	0	0	0	0	0	m
0	0	0	0	0	0	0	0	0	0	0	0	payne automotive sales associate salary	0	0	0	0	0	0	0	0	0	1	m
0	0	0	0	0	0	0	0	0	0	0	0	what is a geometry set	0	0	0	0	0	0	0	0	0	0	m
0	0	0	0	0	0	0	0	0	0	0	0	what does alv stand for	0	0	0	0	0	0	0	0	0	0	m
0	0	0	0	0	0	0	0	0	0	0	0	what is a chest pass	0	0	0	0	0	0	0	0	0	0	m
0	0	0	0	0	0	0	0	0	0	0	0	who governs the trustee in bankruptcy courts	0	0	0	0	0	0	0	0	0	0	m
0	0	0	0	0	0	0	0	0	0	0	0	what is supima cotton fabric	0	0	0	0	0	0	0	0	0	0	m
0	0	0	0	0	0	0	0	0	0	0	0	elder flower scientific name	0	0	0	0	0	0	0	0	0	1	m
0	0	0	0	0	0	0	0	0	0	0	0	why is anxiety	0	0	0	0	0	0	0	0	0	0	m
0	0	0	0	0	0	0	0	0	0	0	0	what does the saying. bread and butter refer to?	0	0	0	0	0	0	0	0	0	0	m
0	0	0	0	0	0	0	0	0	0	0	0	Negotiable Certificate of Deposit what is	0	0	0	0	0	0	0	0	0	1	m
0	0	0	0	0	0	0	0	0	0	0	0	until what age last menopause	0	0	0	0	0	0	0	0	0	0	m
0	0	0	0	0	0	0	0	0	0	0	0	what is a non heated windshield	0	0	0	0	0	0	0	0	0	0	m
0	0	0	0	0	0	0	0	0	0	0	0	how much does an xbox one s weigh	0	0	0	0	0	0	0	0	0	0	m
0	0	0	0	0	0	0	0	0	0	0	0	what pasmore short term bonds are long term	0	0	0	0	0	0	0	0	0	0	m
0	0	0	0	0	0	0	0	0	0	0	0	what are alkaline foods	0	0	0	0	0	0	0	0	0	0	m
0	0	0	0	0	0	0	0	0	0	0	0	cost to maintain bugatti	0	0	0	0	0	0	0	0	0	1	m
0	0	0	0	0	0	0	0	0	0	0	0	is a goal measurable	0	0	0	0	0	0	0	0	0	0	m
0	0	0	0	0	0	0	0	0	0	0	0	what division is uab	0	0	0	0	0	0	0	0	0	0	m
0	0	0	0	0	0	0	0	0	0	0	0	what are roof-mounted condensing units	0	0	0	0	0	0	0	0	0	0	m
0	0	0	0	0	0	0	0	0	0	0	0	mesosalpinx definition	0	0	0	0	0	0	0	0	0	1	m
0	0	0	0	0	0	0	0	0	0	0	1	what are the advantages of saturn	0	0	0	0	0	0	0	0	0	0	m
0	0	0	0	0	0	0	0	0	0	0	0	prudential regulations meaning in urdu	0	0	0	0	0	0	0	0	0	1	m
0	0	0	0	0	0	0	0	0	0	0	0	how many raw eggs should i eat	0	0	0	0	0	0	0	0	0	0	m
0	0	0	0	0	0	0	0	0	0	0	0	what type of doctor treats carpal tunnel	0	0	0	0	0	0	0	0	0	0	m
0	0	0	0	0	0	0	0	0	0	0	0	how to keep berries fresher longer	0	0	0	0	0	0	0	0	0	0	m
0	0	0	0	0	0	0	0	0	0	0	0	iphone number to display imei	0	0	0	0	0	0	0	0	0	1	m
0	0	0	0	0	0	0	0	0	0	0	0	the opposite meaning of genuine	0	0	0	0	0	0	0	0	0	1	m
0	0	0	0	0	0	0	0	0	0	0	0	what is mango powder used for in indian cooking	0	0	0	0	0	0	0	0	0	0	m
0	0	0	0	0	0	0	0	0	0	0	0	what was abraham lincoln	0	0	0	0	0	0	0	0	0	0	m
0	0	0	0	0	0	0	0	0	0	0	0	how many stds are curable	0	0	0	0	0	0	0	0	0	0	m
0	0	0	0	0	0	0	0	0	0	0	0	who wrote the tao of pooh	0	0	0	0	0	0	0	0	0	0	m
0	0	0	0	0	0	0	0	0	0	0	0	what time is it in cdt	0	0	0	0	0	0	0	0	0	0	m
0	0	0	0	0	0	0	0	0	0	0	0	why do federally exclusive jurisdictions pay local taxes?	0	0	0	0	0	0	0	0	0	0	m
0	0	0	0	0	0	0	0	0	0	0	0	what food is good for pancreas to produce insulin	0	0	0	0	0	0	0	0	0	0	m
0	0	0	0	0	0	0	0	0	0	0	0	what is the republic of salo	0	0	0	0	0	0	0	0	0	0	m
0	0	0	0	0	0	0	0	0	0	0	0	drums what is shell pack	0	0	0	0	0	0	0	0	0	1	m
0	0	0	0	0	0	0	0	0	0	0	0	what if ast is low	0	0	0	0	0	0	0	0	0	0	m
0	0	0	0	0	0	0	0	0	0	0	0	what does the name francois mean	0	0	0	0	0	0	0	0	0	0	m
0	0	0	0	0	0	0	0	0	0	0	0	scrub colors dickies	0	0	0	0	0	0	0	0	0	1	m
0	0	0	0	0	0	0	0	0	0	0	0	how much exercise or physical activity should people do daily	0	0	0	0	0	0	0	0	0	0	m
0	0	0	0	0	0	0	0	0	0	0	0	what does sandy live in on spongebob	0	0	0	0	0	0	0	0	0	0	m
0	0	0	0	0	0	0	0	0	0	0	0	how long does it take to get bbsi to pay you money	0	0	0	0	0	0	0	0	0	0	m
0	0	0	0	0	0	0	0	0	0	0	0	how to set goals by nap hill	0	0	0	0	0	0	0	0	0	0	m
0	0	0	0	0	0	0	0	0	0	0	0	what were the failures of the treaty of versailles	0	0	0	0	0	0	0	0	0	0	m
0	0	0	0	0	0	0	0	0	0	0	0	what is ultravate ointment used for	0	0	0	0	0	0	0	0	0	0	m
0	0	0	0	0	0	0	0	0	0	0	0	diatomaceous earth for the skin	0	0	0	0	0	0	0	0	0	1	m
0	0	0	0	0	0	0	0	0	0	0	0	when did harry potter air	0	0	0	0	0	0	0	0	0	0	m
0	0	0	0	0	0	0	0	0	0	0	0	latest judgment of supreme court on limitation as preliminary issue	0	0	0	0	0	0	0	0	0	0	m
0	0	0	0	0	0	0	0	0	0	0	0	who has died on fear the walking dead	0	0	0	0	0	0	0	0	0	0	m
0	0	0	0	0	0	0	0	0	0	0	0	what is the partnership title of the majority owner?	0	0	0	0	0	0	0	0	0	0	m
0	0	0	0	0	0	0	0	0	0	0	0	is mega man a nintendo character	0	0	0	0	0	0	0	0	0	0	m
0	0	0	0	0	0	0	0	0	0	0	0	what is the climate in the  rainforest	0	0	0	0	0	0	0	0	0	0	m
0	0	0	0	0	0	0	0	0	0	0	0	hilo international airport passenger number	0	0	0	0	0	0	0	0	0	1	m
0	0	0	0	0	0	0	0	0	0	0	0	what folder is the drilltopia.xla in	0	0	0	0	0	0	0	0	0	0	m
0	0	0	0	0	0	0	0	0	0	0	0	does shingles cause a temperature	0	0	0	0	0	0	0	0	0	0	m
0	0	0	0	0	0	0	0	0	0	0	0	what chemical makes up man	0	0	0	0	0	0	0	0	0	0	m
0	0	0	0	0	0	0	0	0	0	0	0	what is hs tariff code	0	0	0	0	0	0	0	0	0	0	m
0	0	0	0	0	0	0	0	0	0	0	0	ameren announcement	0	0	0	0	0	0	0	0	0	1	m
0	0	0	0	0	0	0	0	0	0	0	0	what is the use of an o ring	0	0	0	0	0	0	0	0	0	0	m
0	0	0	0	0	0	0	0	0	0	0	0	cast of bromance	0	0	0	0	0	0	0	0	0	1	m
0	0	0	0	0	0	0	0	0	0	0	0	why would a doctor prescribe warfarin	0	0	0	0	0	0	0	0	0	0	m
0	0	0	0	0	0	0	0	0	0	0	0	structure of the digestive that produce enzymes	0	0	0	0	0	0	0	0	0	1	m
0	0	0	0	0	0	0	0	0	0	0	0	what is a ferret in dutch	0	0	0	0	0	0	0	0	0	0	m
0	0	0	0	0	0	0	0	0	0	0	0	what is vpi?	0	0	0	0	0	0	0	0	0	0	m
0	0	0	0	0	0	0	0	0	0	0	0	what city is clayton ca in	0	0	0	0	0	0	0	0	0	0	m
0	0	0	0	0	0	0	0	0	0	0	0	how to cook a thick steak in the oven	0	0	0	0	0	0	0	0	0	0	m
0	0	0	0	0	0	0	0	0	0	0	0	hologram hollywood blvd theater in los angeles	0	0	0	0	0	0	0	0	0	1	m
0	0	0	0	0	0	0	0	0	0	0	0	cost of food in russia us	0	0	0	0	0	0	0	0	0	1	m
0	0	0	0	0	0	0	0	0	0	0	0	how long to grill sweet corn	0	0	0	0	0	0	0	0	0	0	m
0	0	0	0	0	0	0	0	0	0	0	0	what was the effect of the signing of the atlantic charter	0	0	0	0	0	0	0	0	0	0	m
0	0	0	0	0	0	0	0	0	0	0	0	age to work in a hospital in ohio	0	0	0	0	0	0	0	0	0	0	m
0	0	0	0	0	0	0	0	0	0	0	0	what's the zip code for schoolcraft,	0	0	0	0	0	0	0	0	0	0	m
0	0	0	0	0	0	0	0	0	0	0	0	michael carbonaro magic is fake	0	0	0	0	0	0	0	0	0	1	m
0	0	0	0	0	0	0	0	0	0	0	0	who was the union general who defeated the confederate army at the civil war battle of gettysburg?	0	0	0	0	0	0	0	0	0	0	m
0	0	0	0	0	0	0	0	0	0	0	0	what is an overactive hpa axis dysfunction	0	0	0	0	0	0	0	0	0	0	m
0	0	0	0	0	0	0	0	0	0	0	0	what county is portola valley, ca	0	0	0	0	0	0	0	0	0	0	m
0	0	0	0	0	0	0	0	0	0	0	0	joseph price born in hullavington, wilts 1801	0	0	0	0	0	0	0	0	0	0	m
0	0	0	0	0	0	0	0	0	0	0	1	what is the difference between an implied contract and a quasi contract	0	0	0	0	0	0	0	0	0	0	m
0	0	0	0	0	0	0	0	0	0	0	0	what is the normal range for estrogen levels	0	0	0	0	0	0	0	0	0	0	m
0	0	0	0	0	0	0	0	0	0	0	0	how much pressure is in a propane tank	0	0	0	0	0	0	0	0	0	0	m
0	0	0	0	0	0	0	0	0	0	0	0	is the color slate darker than the color espresso.	0	0	0	0	0	0	0	0	0	0	m
0	0	0	0	0	0	0	0	0	0	0	0	can you change mortgage amortization	0	0	0	0	0	0	0	0	0	0	m
0	0	0	0	0	0	0	0	0	0	0	0	what is bankable forbes	0	0	0	0	0	0	0	0	0	0	m
0	0	0	0	0	0	0	0	0	0	0	0	in medical terms what is foraminal	0	0	0	0	0	0	0	0	0	0	m
0	0	0	0	0	0	0	0	0	0	0	0	what is web design protocol for lead generation	0	0	0	0	0	0	0	0	0	0	m
0	0	0	0	0	0	0	0	0	0	0	0	what is class invariant definition	0	0	0	0	0	0	0	0	0	0	m
0	0	0	0	0	0	0	0	0	0	0	0	are tapeworm deadkly	0	0	0	0	0	0	0	0	0	0	m
0	0	0	0	0	0	0	0	0	0	0	0	According to Zephaniah 2, the territory of Moab will become like	0	0	0	0	0	0	0	0	0	1	m
0	0	0	0	0	0	0	0	0	0	0	0	what happened to pocahontas life	0	0	0	0	0	0	0	0	0	0	m
0	0	0	0	0	0	0	0	0	0	0	0	how to view publisher files without publisher	0	0	0	0	0	0	0	0	0	0	m
0	0	0	0	0	0	0	0	0	0	0	0	what does kibitz mean in yiddish	0	0	0	0	0	0	0	0	0	0	m
0	0	0	0	0	0	0	0	0	0	0	0	how fast can a person run	0	0	0	0	0	0	0	0	0	0	m
0	0	0	0	0	0	0	0	0	0	0	0	what font is used on movie takes	0	0	0	0	0	0	0	0	0	0	m
0	0	0	0	0	0	0	0	0	0	0	0	which nuclides are fissile?	0	0	0	0	0	0	0	0	0	0	m
0	0	0	0	0	0	0	0	0	0	0	0	what does flexible seating do for a classroom	0	0	0	0	0	0	0	0	0	0	m
0	0	0	0	0	0	0	0	0	0	0	0	how gold standard worked explain slides	0	0	0	0	0	0	0	0	0	1	m
0	0	0	0	0	0	0	0	0	0	0	0	Honeysuckle name meaning	0	0	0	0	0	0	0	0	0	1	m
0	0	0	0	0	0	0	0	0	0	0	0	where is almo idaho	0	0	0	0	0	0	0	0	0	0	m
0	0	0	0	0	0	0	0	0	0	0	0	can higher doses of levothyroxine ejaculation	0	0	0	0	0	0	0	0	0	0	m
0	0	0	0	0	0	0	0	0	0	0	0	what is clindamycin used for	0	0	0	0	0	0	0	0	0	0	m
0	0	0	0	0	0	0	0	0	0	0	0	when was down to the river by alison krauss released	0	0	0	0	0	0	0	0	0	0	m
0	0	0	0	0	0	0	0	0	0	0	0	war is characterized as an interaction of	0	0	0	0	0	0	0	0	0	0	m
0	0	0	0	0	0	0	0	0	0	0	0	what affects the outcome of a testosterone test	0	0	0	0	0	0	0	0	0	0	m
0	0	0	0	0	0	0	0	0	0	0	0	what causes non stop diarrhea	0	0	0	0	0	0	0	0	0	0	m
0	0	0	0	0	0	0	0	0	0	0	0	when do items fall off your credit report	0	0	0	0	0	0	0	0	0	0	m
0	0	0	0	0	0	0	0	0	0	0	0	what does exhale mean	0	0	0	0	0	0	0	0	0	0	m
0	0	0	0	0	0	0	0	0	0	0	0	weather in middletown ct	0	0	0	0	0	0	0	0	0	0	m
0	0	0	0	0	0	0	0	0	0	0	0	starting salary for a social worker with a master's degree	0	0	0	0	0	0	0	0	0	1	m
0	0	0	0	0	0	0	0	0	0	0	0	who is justin hartley married to	0	0	0	0	0	0	0	0	0	0	m
0	0	0	0	0	0	0	0	0	0	0	0	how much vitamin c is in strawberries	0	0	0	0	0	0	0	0	0	0	m
0	0	0	0	0	0	0	0	0	0	0	1	the largest cartilage of the trachea is	0	0	0	0	0	0	0	0	0	0	m
0	0	0	0	0	0	0	0	0	0	0	1	difference between standard and first class mail	0	0	0	0	0	0	0	0	0	1	m
0	0	0	0	0	0	0	0	0	0	0	0	where was keke palmer born	0	0	0	0	0	0	0	0	0	0	m
0	0	0	0	0	0	0	0	0	0	0	0	how to tell age of tire	0	0	0	0	0	0	0	0	0	0	m
0	0	0	0	0	0	0	0	0	0	0	0	what does a sea wall do	0	0	0	0	0	0	0	0	0	0	m
0	0	0	0	0	0	0	0	0	0	0	0	what percentage packet loss is acceptable	0	0	0	0	0	0	0	0	0	0	m
0	0	0	0	0	0	0	0	0	0	0	0	how long does it take for water to get cold in the freezer	0	0	0	0	0	0	0	0	0	0	m
0	0	0	0	0	0	0	0	0	0	0	0	how has apple successfully used behavioral segmentation to develop extreme loyalty among its customers?	0	0	0	0	0	0	0	0	0	0	m
0	0	0	0	0	0	0	0	0	0	0	0	who is the mayor of university heights oh?	0	0	0	0	0	0	0	0	0	0	m
0	0	0	0	0	0	0	0	0	0	0	0	how to select date in datepicker using selenium webdriver	0	0	0	0	0	0	0	0	0	0	m
0	0	0	0	0	0	0	0	0	0	0	0	thalassemia minor symptoms and treatment	0	0	0	0	0	0	0	0	0	1	m
0	0	0	0	0	0	0	0	0	0	0	0	what hotel is next to the palms in vegas	0	0	0	0	0	0	0	0	0	0	m
0	0	0	0	0	0	0	0	0	0	0	0	what is stroke	0	0	0	0	0	0	0	0	0	0	m
0	0	0	0	0	0	0	0	0	0	0	0	cost of stamp duty in ghana	0	0	0	0	0	0	0	0	0	1	m
0	0	0	0	0	0	0	0	0	0	0	0	medical what is the daily requirements for calcium in the diet?	0	0	0	0	0	0	0	0	0	0	m
0	0	0	0	0	0	0	0	0	0	0	0	define phy	0	0	0	0	0	0	0	0	0	1	m
0	0	0	0	0	0	0	0	0	0	0	0	can regular barbie dolls go in the water	0	0	0	0	0	0	0	0	0	0	m
0	0	0	0	0	0	0	0	0	0	0	0	season i transparency prime	0	0	0	0	0	0	0	0	0	1	m
0	0	0	0	0	0	0	0	0	0	0	0	obstetric meeaning	0	0	0	0	0	0	0	0	0	1	m
0	0	0	0	0	0	0	0	0	0	0	0	can cycling help reduce belly fat	0	0	0	0	0	0	0	0	0	0	m
0	0	0	0	0	0	0	0	0	0	0	0	court material definition	0	0	0	0	0	0	0	0	0	1	m
