difficulty	preference	context	aspect	direct	opinion	argument	reason	method	factoid	super	comp	question	item1	item2	item3	comp_aspect1	comp_aspect2	non-serious	navigational	spelling	rude	not question	dataset
												how much does it cost to install siding cabinets on a home											m
												where is the falkland islands											m
												how long do you boil ribs before grilling them											m
												when are inherited ira rmd due											m
												which community first embraced the rocky horror picture show and began developing the rituals surrounding the film?											m
												what happened to Richard Poole in death in paradise											m
												who is jennifer rebholz											m
												what is navitaire											m
												who played peterman on seinfeld											m
												westpac telegraphic transfer rate											m
												what are the primary purposes of the party system											m
												what makes up human blood											m
												zeal definition											m
												meaning of the name yvonne											m
												how much money do international fund managers make											m
												highest price paid for a comic book											m
												what does a fractured thumb look like											m
												how old is ruth rogers river cafe											m
												which layer of the atmosphere do satellites orbit?											m
												what are the climate characteristics of mcmurdo antarctica											m
												what type of trust is a charitable foundation											m
												what is drop length bed skirt											m
												signature bank routing number											m
												what are four pieces of evidence alfred wegener used to support his theory of continental drift											m
												chemical composition of cereals											m
												why to do a psych evaluation											m
												how to treat dry skin in kids											m
												temperature of water in fort lauderdale in october											m
												daily carbohydrate recommendation for prediabetes											m
												define incursion											m
												democracy is bad											m
												ambulatory surgery means what											m
												what is the symbolism of horus in a dream											m
												what is hi-fi sound system											m
												Highest Melting Point											m
												when is compliance week											m
												what does pneumatized mean											m
												how many calories should i eat to lose weight if i workout alot											m
												is drug diversion negligence											m
												how much tax is owed on life insurance payout											m
												forthrightness definition											m
												how far away is a light year											m
												what herbs can you use for toning											m
												what engine does dark souls run on?											m
												how much does it cost to replace shocks on an audi											m
												what is the kata											m
												how to print on envelopes using HP8610											m
												what is a curr?											m
												phone number for boost mobile											m
												what is the fluid inside a blister called											m
												what to do with white tail lungs?											m
												when can longhorn male calf											m
												what does the term take-offs mean in the construction field											m
												how does a trickle battery charger work											m
												what is the resistance of a rowing machine?											m
												tension electrical definition											m
												what happens to the current in a circuit if the resistance is increased?											m
												what are the standard sizes of steel beams											m
												what does it mean when an unknown error occurs restoring my iphone											m
												causes of a aortic aneurysm											m
												how long does it take for hydrocodone to kick in											m
												what vitamins and dosage to take for reversing grey hair											m
												can allergies tinnitus											m
												average cost per square foot west point ga											m
												how to make a nightwing mask											m
												what is concurrent supervision, cms											m
												what is the energy transferring with hands											m
												is colander the same thing as a strainer											m
												did charlton heston play in hamlet											m
												two types jeep cherokee headlights											m
												how far can fleas jump											m
												weighted component cost of capital											m
												what is the existing obamacare health care plan for a senator and congressman											m
												what does critically injured mean											m
												how do automotive technicians get paid											m
												why does children need healthy relationships											m
												nist definitions of private and community clouds											m
												how is hamlet morally ambiguous											m
												which brand makes the best refrigerators											m
												how tall how tall is michelle obama?											m
												meaning of bonding in adhesives											m
												types of computer malware											m
												how to preserve meat											m
												how is vanilla processed											m
												does a charity have to pay sales tax in ohio											m
												what are factorials											m
												what benefits do seiu employees get											m
												should crisco be stored in the refrigerator											m
												definition of data application											m
												how long a flight from detroit to chicago											m
												article on adopted children should have access to birth records											m
												what foods to eat before bedtime											m
												which side of wall does one insulate to keep noise from going to other room											m
												what part of the plant leaves does photosynthesis take place											m
												date of pa primary 1976											m
												who built vizcaya											m
												what years were buffalo nickels made											m
												who needs a hhccn form?											m
												how many sq. miles is hershey park											m
												what was taxed in the stamp acts											m
												where does the name tallant originate											m
												nasia meaning											m
												cost of pumping a septic tank											m
												are mmr and varicella given a month after the first dose for adults											m
												why are long term interest rates rising											m
												what languages are spoken in cambodia											m
												what kind of cancer spreads to the liver											m
												does anyone still use phone books											m
												what hormone reduces urine output											m
												is ham processed meat											m
												woodland bank routing number											m
												kentucky horse park phone number											m
												how long to double money											m
												how much money do an athletic trainer makes											m
												what language does guyanese people speak											m
												what day does dove season open in mississippi											m
												at what temperature does methane gas ignite											m
												how much can you contribute to your hsa											m
												where is new animal hospital											m
												approximate cost of a conservatory											m
												what does a normal vergina look like											m
												is glucose a ketohexose											m
												what does a polar bear eat											m
												do nursing agencies provide short term disability											m
												what is the most secure network topology											m
												what's the weather in utah?											m
												can an agent complete a ny auto id card											m
												what is the main place of wear the brain is hit											m
												which musical instrument was invented by benjamin franklin											m
												what is a silver tongue											m
												what is the slime in okra											m
												what is blue collar work											m
												how much iodine should a persont take											m
												what does the tegmentum control											m
												what county is niota, tn in											m
												per capita water requirement											m
												pokemon emerald hm rock smash location											m
												can you install windows on a rasperry pi											m
												what causes crankshaft to break											m
												how did baroque art differ from renaissance ?											m
												define pulp canal											m
												which of these glands is not associated with steroid hormone production											m
												numb hands causes											m
												what to do when a tornado hits while driving											m
												how many people visit seaworld											m
												itt pearl harbor hours											m
												what kind of company is dialogtech?											m
												when did the maccabees rule											m
												cost cutters sabino canyon											m
												what is a herd prefix											m
												which mineral is a component of ATP											m
												hpv vaccination how long the second											m
												what does occupancy rate mean											m
												how much chocolate can a dog eat?											m
												who is the creator of anime											m
												what is needed to purchase homeowners insurance											m
												tarp systems											m
												what are the special items needed to evolve some pokemon?											m
												us restaurant sf gaspare											m
												what defines a marriageable lady											m
												australian passport renewal before expiry											m
												how to insert in text citation apa											m
												why do people do spring cleaning											m
												please define precocious											m
												did heisenberg build a reactor											m
												where is the actual site of seafloor spreading											m
												what the deadline to file taxes											m
												can a fan cause a cold											m
												how to find table name in stored procedure											m
												what do all waves move through											m
												what strategies were used by administrative agencies in order to implement the great society?											m
												what degree do undergraduate business students get											m
												salary warden federal prison											m
												what is worm waste called											m
												what are the hr tasks to improve employee relations											m
												which region was tectonically active during the cenozoic era?											m
												letterer siwe disease definition											m
												pilot implementation definition											m
												was the netherlands a colony of britain											m
												how long does it take blood to pump once through your body?											m
												warfarin side effects											m
												how to add a column in a pivot table											m
												what is lamotrigine used for											m
												what causes ear odor											m
												who owns the film rights to the lord of the rings											m
												how to find bank routing number without check founders											m
												how to set windows defender as default											m
												what does machine wash warm mean											m
												causes of toasted skin syndrome											m
												what causes thermal energy											m
												is malathion used for killing mosquitoes											m
												do you need a degree to be an investigator?											m
												wayne state university tuition per year											m
												fastest speed on an elliptigo bike											m
												what caused king tut's death											m
												mayo cortisone shot											m
												what the process of migrating existing data to the testing platform.											m
												symptoms of ricin											m
												how to use mil dot											m
												how many acres of peaches in georgia											m
												porcupine spirit animal meaning											m
												what does it mean when you can't open up a snapchat story											m
												what is KN1 olant biology											m
												define feeble minded.											m
												how long should you soak canna lily seeds before planting											m
												does menopur have to be refrigerated											m
												meaning of ecchymosis											m
												how much does a kindergarten teacher make											m
												what does analog and digital mean											m
												what time is in pst pacific standard time?											m
												how many protein does a scrambled egg have?											m
												what is brown warm or cold color?											m
												what age do most women get cancer											m
												meaning of the aztec calendar											m
												what hard drive is in hp omen laptop											m
												what causes blackouts and memory loss											m
												are council members elected or appointed											m
												how long does it take for a medicine to be out of your system											m
												what is the plural of yes											m
												what is an analysis pdf											m
												where is defense information systems agency located											m
												which statement is true regarding the motion of liquid water molecules and ice molecules?											m
												who was the composer for the song so this is love											m
												what do japanese people eat on a regular day											m
												when was united states government formed											m
												prevent deleting history chrome											m
												is the process of changing the appearance of a paragraph.											m
												what is full employment rate											m
												minimum calories per day to lose weight											m
												definition of polysaccharide											m
												how many turkeys do americans eat each year											m
												master cylinder cost											m
												how hot does plasma get											m
												adp employee customer service number											m
												what are venous valves											m
												what causes worry and anxiety											m
												what are the symptoms of syphilis in males											m
												how wide is a bike lane											m
												how much does it cost per acre to replace gas lines											m
												average salary of bank ceo											m
												what is an opposable thumb											m
												how to say cheers in welsh											m
												skyforge how to get sparks fast											m
												prostate cancer symptoms women											m
												how much to phone a us toll free number from uk											m
												what is autistic spectrum disorder											m
												can you bond a tooth that cracked straight across											m
												who composed airplanes											m
												how long is a speed skating track											m
												what company is alief											m
												is gel bad for your hair											m
												what temperature should a freezer hold											m
												what is regular rpm											m
												is i-loan a publicly traded company											m
												how many people have anxiety											m
												what rpm does a my passport have											m
												how many mb are in a gb of data											m
												what is a boxer eng?											m
												what does diamond in the back mean											m
												what is prototype psychology											m
												is banking transit the routing number											m
												which particle is j. j. thomson credited with discovering?											m
												what is tty											m
												what is a statistical f table											m
												kirisin is learning about the outer planets. what else would she know about a planet that is the second largest gas giant and has the largest rings?											m
												what treats psoriasis											m
												what is vr in naval terms											m
												when metals form ions they tend to form											m
												how to light a sparkler											m
												vegan diet for thyroid problems											m
												what neurotransmitter systems are effectedby mescaline											m
												temperature units of the metric system											m
												how long is a woman's egg viable											m
												what caused the peloponnesian war											m
												what does the united nations do to promote peace											m
												what happens when hiv infected body fluids dry out											m
												what is wheatgrass in											m
												does uptown alley have an age limit on laser tag											m
												what is the weather in ely mn											m
												why is self concept important											m
												how much overweight to get gastric bypass											m
												what is the size of the crust											m
												is there a real legit binary options trading											m
												how much does a website designer make per											m
												why would you need to replace network switches											m
												difference between bonus and commission											m
												what cause hallucinations in middle aged men.											m
												what information protection method may be implemented											m
												does chile prevent cancer											m
												side effects of fosteum											m
												how to use american currency in haiti											m
												benefits of ribose rx energy											m
												how do carbs and protein need differ from strength/power athletes from others											m
												what is mid shift hours											m
												average temperature in october for joplin, mo											m
												what county is beloit wi in'											m
												what does the eu pravo											m
												when does the new spiderman movie come out											m
												how to do a musculoskeletal sports physical											m
												zoloft withdrawal how long											m
												what rubbing means											m
												what does CVM promotion means											m
												where is harpers ferry, wv											m
												Damaged cells of an organism are usually Choose... rebuilt renewed repaired replaced by mitosis											m
												where is mountain adams											m
												when did discman come out											m
												pronounce verbatims											m
												hydroelectric energy: definition											m
												what is a legal signature for passport application											m
												ksh scripting how to search and delete a line in a file											m
												where is little switzerland north carolina											m
												when did dodo bird go extinct											m
												longest yard caretaker											m
												can i update my jailbroken phone											m
												how do you get a copy of your birth certificate											m
												how much is alan jackson worth											m
												average sleep for kids											m
												gratuit definition											m
												how many main quests are in breath of the wild											m
												how far is Ipswich from Boston?											m
												what cphi  stands for											m
												how does the woman period come											m
												cost of a vet visit for a cat											m
												who is shirley temple											m
												burial metamorphism definition geology											m
												tofu expiration date											m
												where firefox bookmarks stored											m
												how many grad hours per semester oklahoma university											m
												what is fractionation technique											m
												The term Abstract Expressionism was first used to define the style of											m
												when can i do a non judicial settlement agreement											m
												how long is food good for after power outage											m
												what does frequency mean											m
												pistachio flavoring mccormick											m
												where did humanism originate											m
												meaning of choking											m
												what is the cc in an email											m
												effects of yoga on mental and physical health ncbi											m
												where is gonzales la											m
												where do idioventricular rhythms originate											m
												how long lottery											m
												starting salary for registered nurse in california											m
												what happened to miami marlins pitcher											m
												can green tea cause dry throat											m
												when will netflix have another season of the fall											m
												what was banned during the prohibition era?											m
												what is berry compliant											m
												define posterior pole											m
												how to set up food bank at church											m
												how many feet from a fire											m
												how long does it take play therapy to work											m
												what are wind tunnels											m
												leading to adaptation of populations											m
												hysteria medical definition											m
												what is the biggest airlines in asia pacific											m
												required hours for lcdc											m
												what is the average entry level annual salary as a firefighter											m
												what is hogg farm in leander											m
												define: subtle											m
												what is the normal human body temperature											m
												does vodka contain phosphorus											m
												What is enovenomation											m
												what is typical foreign transaction fee on credit cards											m
												what is pdic											m
												when was stag pocket fish knives made in ireland?											m
												what does carnivora treat											m
												how much does it cost to have sliding glass doors installed											m
												what organ delivers nutrients to the developing embryo and produces estrogen and progesterone?											m
												how much weight can a guy carry a girl											m
												when was martin king born											m
												what nationality is nasser											m
												who did sarah silverman used to date											m
												what causes colitis infection											m
												what is a rhetorical devices											m
												what are special courts also known as											m
												what is a preamp guitar											m
												hallock state park hours											m
												how can you look at members on match without them knowing you're looking											m
												population of winnemucca nevada											m
												which of these indicates that a liquid has transferred thermal energy to the air?											m
												glipizide function											m
												telephone number to track unemployment check											m
												when was kristin chenoweth born											m
												how much paint will i need to repaint a netball court											m
												what is boc mean in federal government employment											m
												when did diners club start the credit cards											m
												what state were the wright bros from											m
												what does e pluribus unim mean											m
												what class is a panda?											m
												what is the cycle of atp											m
												outlook increase move to folder list registry setting											m
												irs deductible points											m
												how to prime iv tubing with cassette											m
												does chocolate pie need to be refrigerated											m
												what is an action for specific performance											m
												what should the temperature of milk before drinking?											m
												what skills make student college and career ready											m
												dr craig hamasaki phone number											m
												how much is cord blood banking cost											m
												where is pleasure beach											m
												what is a Railroad signal unit											m
												where is farm pride located											m
												how long after ovulation pregnant											m
												iphone 5s how to take out battery											m
												can i get help for my over 21 disabled child from after a divorce											m
												what number is silver in overwatch											m
												can i build a different tophalf on my boat? site:www.boatdesign.net											m
												how to change a nose stud for the first time											m
												what is seroquel classified as											m
												what type of tissue creates scars											m
												representative tarleton washington											m
												what is an indexer											m
												how to count ovulation period											m
												how many session n does greys											m
