difficulty	preference	context	aspect	direct	opinion	argument	reason	method	factoid	super	comp	question	item1	item2	item3	comp_aspect1	comp_aspect2	non-serious	navigational	spelling	rude	not question	dataset
0	0	0	0	0	0	0	0	0	0	0	0	why is my discharge very sticky and mucus like	0	0	0	0	0	0	0	0	0	0	m
0	0	0	0	0	0	0	0	0	0	0	0	is nickel a cause of kidney disease?	0	0	0	0	0	0	0	0	0	0	m
0	0	0	0	0	0	0	0	0	0	0	0	can intuniv cause night sweats	0	0	0	0	0	0	0	0	0	0	m
0	0	0	0	0	0	0	0	0	0	0	0	herbalist in	0	0	0	0	0	0	0	0	0	1	m
0	0	0	0	0	0	0	0	0	0	0	0	is abine legitimate	0	0	0	0	0	0	0	0	0	1	m
0	0	0	0	0	0	0	0	0	0	0	0	can gabapentin cause loose stools and stomach pains	0	0	0	0	0	0	0	0	0	0	m
0	0	0	0	0	0	0	0	0	0	0	1	what is bigger bits or giga	0	0	0	0	0	0	0	0	0	0	m
0	0	0	0	0	0	0	0	0	0	0	0	what occurs during meiosis and what is the end product	0	0	0	0	0	0	0	0	0	0	m
0	0	0	0	0	0	0	0	0	0	0	0	which party introduced  freedom of information act	0	0	0	0	0	0	0	0	0	0	m
0	0	0	0	0	0	0	0	0	0	0	0	how could trump's wall help solve crimes	0	0	0	0	0	0	0	0	0	0	m
0	0	0	0	0	0	0	0	0	0	0	0	minimum wage job definition	0	0	0	0	0	0	0	0	0	1	m
0	0	0	0	0	0	0	0	0	0	0	0	fafsa requirements credit hours	0	0	0	0	0	0	0	0	0	1	m
0	0	0	0	0	0	0	0	0	0	0	0	how many goals does cristiano ronaldo have for his country?	0	0	0	0	0	0	0	0	0	0	m
0	0	0	0	0	0	0	0	0	0	0	0	what is the shelf life of venus teeth whitening gel	0	0	0	0	0	0	0	0	0	0	m
0	0	0	0	0	0	0	0	0	0	0	0	who sings sledgehammer?	0	0	0	0	0	0	0	0	0	0	m
0	0	0	0	0	0	0	0	0	0	0	0	what or who is a bouncer?	0	0	0	0	0	0	0	0	0	0	m
0	0	0	0	0	0	0	0	0	0	0	0	what is the bond order in no?	0	0	0	0	0	0	0	0	0	0	m
0	0	0	0	0	0	0	0	0	0	0	1	most popular kitchen cabinets	0	0	0	0	0	0	0	0	0	1	m
0	0	0	0	0	0	0	0	0	0	0	0	what was the truman doctrine and how did it cause a controversy	0	0	0	0	0	0	0	0	0	0	m
0	0	0	0	0	0	0	0	0	0	0	1	which mmo has been operating the longest	0	0	0	0	0	0	0	0	0	0	m
0	0	0	0	0	0	0	0	0	0	0	0	where does the schultz name originate	0	0	0	0	0	0	0	0	0	0	m
0	0	0	0	0	0	0	0	0	0	0	0	what is the significance of stratospheric ozone for life on earth?	0	0	0	0	0	0	0	0	0	0	m
0	0	0	0	0	0	0	0	0	0	0	1	difference between blood clot and muscle pain	0	0	0	0	0	0	0	0	0	1	m
0	0	0	0	0	0	0	0	0	0	0	0	is it safe to take one tablespoon of apple cider vinegar a day for indigestion	0	0	0	0	0	0	0	0	0	0	m
0	0	0	0	0	0	0	0	0	0	0	0	pro football preseason schedule	0	0	0	0	0	0	0	0	0	0	m
0	0	0	0	0	0	0	0	0	0	0	0	what does a blood test for the liver show	0	0	0	0	0	0	0	0	0	0	m
0	0	0	0	0	0	0	0	0	0	0	0	how did the franco-prussian war start	0	0	0	0	0	0	0	0	0	0	m
0	0	0	0	0	0	0	0	0	0	0	0	where is nettle usually grown	0	0	0	0	0	0	0	0	0	0	m
0	0	0	0	0	0	0	0	0	0	0	0	can a rental agreement be broken when no lease is signed	0	0	0	0	0	0	0	0	0	0	m
0	0	0	0	0	0	0	0	0	0	0	0	how much do nba referees make	0	0	0	0	0	0	0	0	0	0	m
0	0	0	0	0	0	0	0	0	0	0	0	columbia threadneedle previous name	0	0	0	0	0	0	0	0	0	1	m
0	0	0	0	0	0	0	0	0	0	0	0	how many dispensations are there in a hyper dispensationalism	0	0	0	0	0	0	0	0	0	0	m
0	0	0	0	0	0	0	0	0	0	0	0	climate] definition	0	0	0	0	0	0	0	0	0	1	m
0	0	0	0	0	0	0	0	0	0	0	0	time difference between singapore and zurich	0	0	0	0	0	0	0	0	0	1	m
0	0	0	0	0	0	0	0	0	0	0	0	can radiation therapy cause pleural effusion years laterl	0	0	0	0	0	0	0	0	0	0	m
0	0	0	0	0	0	0	0	0	0	0	0	how wide is a motorhome	0	0	0	0	0	0	0	0	0	0	m
1	0	0	0	0	0	0	0	0	0	0	1	what part of your arm do you use for the bump pass	0	0	0	0	0	0	0	0	0	0	m
0	0	0	0	0	0	0	0	0	0	0	0	what are cisco input output errors	0	0	0	0	0	0	0	0	0	0	m
0	0	0	0	0	0	0	0	0	0	0	0	what was the impact of television during the vietnam war?	0	0	0	0	0	0	0	0	0	0	m
0	0	0	0	0	0	0	0	0	0	0	0	what is the range of a tesla car	0	0	0	0	0	0	0	0	0	0	m
0	0	0	0	0	0	0	0	0	0	0	0	what is sausage paella	0	0	0	0	0	0	0	0	0	0	m
0	0	0	0	0	0	0	0	0	0	0	1	what to sprinkle on pineapple	0	0	0	0	0	0	0	0	0	0	m
0	0	0	0	0	0	0	0	0	0	0	0	what basketball player just retired	0	0	0	0	0	0	0	0	0	0	m
0	0	0	0	0	0	0	0	0	0	0	0	when do futures expire	0	0	0	0	0	0	0	0	0	0	m
0	0	0	0	0	0	0	0	0	0	0	0	ii) average collection period	0	0	0	0	0	0	0	0	0	1	m
0	0	0	0	0	0	0	0	0	0	0	0	highest stock prices	0	0	0	0	0	0	0	0	0	1	m
0	0	0	0	0	0	0	0	0	0	0	0	what are the chevy recalls	0	0	0	0	0	0	0	0	0	0	m
0	0	0	0	0	0	0	0	0	0	0	0	what kind of dance shakira does	0	0	0	0	0	0	0	0	0	0	m
0	0	0	0	0	0	0	0	0	0	0	0	wabi meaning	0	0	0	0	0	0	0	0	0	1	m
0	0	0	0	0	0	0	0	0	0	0	0	what is a mooring statement	0	0	0	0	0	0	0	0	0	0	m
0	0	0	0	0	0	0	0	0	0	0	0	how many members are in the cia?	0	0	0	0	0	0	0	0	0	0	m
0	0	0	0	0	0	0	0	0	0	0	0	where is the pacific area?	0	0	0	0	0	0	0	0	0	0	m
0	0	0	0	0	0	0	0	0	0	0	0	is nerve damage crossed	0	0	0	0	0	0	0	0	0	0	m
0	0	0	0	0	0	0	0	0	0	0	0	what age should have their injections babies	0	0	0	0	0	0	0	0	0	0	m
0	0	0	0	0	0	0	0	0	0	0	0	how often do 3 month olds eat	0	0	0	0	0	0	0	0	0	0	m
0	0	0	0	0	0	0	0	0	0	0	0	salary of vice president credit suisse new york	0	0	0	0	0	0	0	0	0	1	m
0	0	0	0	0	0	0	0	0	0	0	0	brinks money phone number	0	0	0	0	0	0	0	0	0	1	m
0	0	0	0	0	0	0	0	0	0	0	0	reference point scientific definition	0	0	0	0	0	0	0	0	0	1	m
0	0	0	0	0	0	0	0	0	0	0	0	how to identify holley carb	0	0	0	0	0	0	0	0	0	0	m
1	0	0	0	0	0	0	0	0	0	0	0	how long before food becomes too old to eat	0	0	0	0	0	0	0	0	0	0	m
0	0	0	0	0	0	0	0	0	0	0	0	how much does acupuncturist doctor earn	0	0	0	0	0	0	0	0	0	0	m
0	0	0	0	0	0	0	0	0	0	0	0	are reflexes affected in motor neurone disease	0	0	0	0	0	0	0	0	0	0	m
0	0	0	0	0	0	0	0	0	0	0	0	what does a landlord do if the tenant does not file an answer	0	0	0	0	0	0	0	0	0	0	m
0	0	0	0	0	0	0	0	0	0	0	0	how much water to drink a day women	0	0	0	0	0	0	0	0	0	0	m
0	0	0	0	0	0	0	0	0	0	0	0	how long is the incubation period for raising butterflies	0	0	0	0	0	0	0	0	0	0	m
1	0	0	0	0	0	0	0	0	0	0	0	what is considered an early childhood professional?	0	0	0	0	0	0	0	0	0	0	m
0	0	0	0	0	0	0	0	0	0	0	0	which is a term used to describe a system that endeavors to maintain natural resources such as soil and water while producing food products?	0	0	0	0	0	0	0	0	0	0	m
0	0	0	0	0	0	0	0	0	0	0	0	how to freeze leftover gumbo	0	0	0	0	0	0	0	0	0	0	m
0	0	0	0	0	0	0	0	0	0	0	0	weather in dubai in september	0	0	0	0	0	0	0	0	0	0	m
0	0	0	0	0	0	0	0	0	0	0	0	how far between reagan international airport and mt vernon	0	0	0	0	0	0	0	0	0	0	m
0	0	0	0	0	0	0	0	0	0	0	0	is bank direct fdic insured	0	0	0	0	0	0	0	0	0	0	m
0	0	0	0	0	0	0	0	0	0	0	0	ikano sa	0	0	0	0	0	0	0	0	0	1	m
0	0	0	0	0	0	0	0	0	0	0	0	what is cmd exe application error	0	0	0	0	0	0	0	0	0	0	m
0	0	0	0	0	0	0	0	0	0	0	0	what is otrexup for	0	0	0	0	0	0	0	0	0	0	m
0	0	0	0	0	0	0	0	0	0	0	0	who is the oa	0	0	0	0	0	0	0	0	0	0	m
0	0	0	0	0	0	0	0	0	0	0	0	audi a8 us price	0	0	0	0	0	0	0	0	0	1	m
0	0	0	0	0	0	0	0	0	0	0	0	sick/safe hours	0	0	0	0	0	0	0	0	0	1	m
0	0	0	0	0	0	0	0	0	0	0	0	what to do with corns on feet	0	0	0	0	0	0	0	0	0	0	m
0	0	0	0	0	0	0	0	0	0	0	0	what county is vonore tn in	0	0	0	0	0	0	0	0	0	0	m
0	0	0	0	0	0	0	0	0	0	0	0	how to get a trout stamp mesa az	0	0	0	0	0	0	0	0	0	0	m
0	0	0	0	0	0	0	0	0	0	0	0	definition of normal risk	0	0	0	0	0	0	0	0	0	1	m
0	0	0	0	0	0	0	0	0	0	0	0	who plays burt on big bang theory	0	0	0	0	0	0	0	0	0	0	m
0	0	0	0	0	0	0	0	0	0	0	0	are background checks sent certified mail	0	0	0	0	0	0	0	0	0	0	m
0	0	0	0	0	0	0	0	0	0	0	0	what is vtp in pregnancy?	0	0	0	0	0	0	0	0	0	0	m
0	0	0	0	0	0	0	0	0	0	0	0	what happened to the jews of stopnica at ww2	0	0	0	0	0	0	0	0	0	0	m
0	0	0	0	0	0	0	0	0	0	0	0	what does clearing cookies and data mean	0	0	0	0	0	0	0	0	0	0	m
1	0	0	0	0	0	0	0	0	0	0	0	when is a bypass surgery needed	0	0	0	0	0	0	0	0	0	0	m
0	0	0	0	0	0	0	0	0	0	0	0	how to update address on groupon	0	0	0	0	0	0	0	0	0	0	m
1	0	0	0	0	0	0	0	0	0	0	0	side effects peanut butter	0	0	0	0	0	0	0	0	0	1	m
0	0	0	0	0	0	0	0	0	0	0	0	years of benefits service for accenture retiree medical	0	0	0	0	0	0	0	0	0	0	m
0	0	0	0	0	0	0	0	0	0	0	0	define dsh female cat	0	0	0	0	0	0	0	0	0	1	m
0	0	0	0	0	0	0	0	0	0	0	0	jo rivera net worth	0	0	0	0	0	0	0	0	0	0	m
0	0	0	0	0	0	0	0	0	0	0	0	what is the sales tax rate in north carolina brunswick county	0	0	0	0	0	0	0	0	0	0	m
0	0	0	0	0	0	0	0	0	0	0	0	can severe sunburn cause swelling in legs and feet	0	0	0	0	0	0	0	0	0	0	m
0	0	0	0	0	0	0	0	0	0	0	0	how to fix my car paint after a dented	0	0	0	0	0	0	0	0	0	0	m
0	0	0	0	0	0	0	0	0	0	0	0	is a millipede a herbivore	0	0	0	0	0	0	0	0	0	0	m
0	0	0	0	0	0	0	0	0	0	0	0	what is bun in b	0	0	0	0	0	0	0	0	0	0	m
0	0	0	0	0	0	0	0	0	0	0	0	what do you call the sash worn at graduation	0	0	0	0	0	0	0	0	0	0	m
0	0	0	0	0	0	0	0	0	0	0	0	how long does it take for UPS to update tracking	0	0	0	0	0	0	0	0	0	0	m
0	0	0	0	0	0	0	0	0	0	0	0	does cellular data cost money	0	0	0	0	0	0	0	0	0	0	m
0	0	0	0	0	0	0	0	0	0	0	0	what is gsr emotions	0	0	0	0	0	0	0	0	0	0	m
0	0	0	0	0	0	0	0	0	0	0	0	learning the basics of surgery	0	0	0	0	0	0	0	0	0	1	m
0	0	0	0	0	0	0	0	0	0	0	0	woman who david beador had an affair with	0	0	0	0	0	0	0	0	0	0	m
0	0	0	0	0	0	0	0	0	0	0	0	how are microwaves generated	0	0	0	0	0	0	0	0	0	0	m
0	0	0	0	0	0	0	0	0	0	0	0	can you post bond without being arrested	0	0	0	0	0	0	0	0	0	0	m
0	0	0	0	0	0	0	0	0	0	0	0	what is umeclidinium	0	0	0	0	0	0	0	0	0	0	m
0	0	0	0	0	0	0	0	0	0	0	1	what is a.good vitamin to enhance the brain	0	0	0	0	0	0	0	0	0	0	m
0	0	0	0	0	0	0	0	0	0	0	0	define mu	0	0	0	0	0	0	0	0	0	1	m
0	0	0	0	0	0	0	0	0	0	0	0	what rocks can you find in continental crust	0	0	0	0	0	0	0	0	0	0	m
0	0	0	0	0	0	0	0	0	0	0	0	how to convert grams per cubic centimeter to pounds per cubic inch	0	0	0	0	0	0	0	0	0	0	m
0	0	0	0	0	0	0	0	0	0	0	0	how to light gas fireplace pilot	0	0	0	0	0	0	0	0	0	0	m
0	0	0	0	0	0	0	0	0	0	0	0	dr.maria grosch stl npi number	0	0	0	0	0	0	0	0	0	1	m
0	0	0	0	0	0	0	0	0	0	0	0	cre epidemiology	0	0	0	0	0	0	0	0	0	1	m
0	0	0	0	0	0	0	0	0	0	0	0	what is color match rgb	0	0	0	0	0	0	0	0	0	0	m
1	0	0	0	0	0	0	0	0	0	0	0	who was the first englishman to grow tobacco	0	0	0	0	0	0	0	0	0	0	m
0	0	0	0	0	0	0	0	0	0	0	0	how to become an ob gyn nurse practitioner	0	0	0	0	0	0	0	0	0	0	m
0	0	0	0	0	0	0	0	0	0	0	0	stock price for dollar general	0	0	0	0	0	0	0	0	0	1	m
0	0	0	0	0	0	0	0	0	0	0	0	care now tech ridge fax number	0	0	0	0	0	0	0	0	0	1	m
0	0	0	0	0	0	0	0	0	0	0	0	definition for symptoms	0	0	0	0	0	0	0	0	0	1	m
1	0	0	0	0	0	0	0	0	0	0	0	who made the stratocaster great	0	0	0	0	0	0	0	0	0	0	m
0	0	0	0	0	0	0	0	0	0	0	1	what train station is nearest louvre in paris	0	0	0	0	0	0	0	0	0	0	m
1	0	0	0	0	0	0	0	0	0	0	0	how do you say money in German mean	0	0	0	0	0	0	0	0	0	0	m
0	0	0	0	0	0	0	0	0	0	0	0	weather in quito ecuador in september	0	0	0	0	0	0	0	0	0	0	m
0	0	0	0	0	0	0	0	0	0	0	0	what's the zip code for boerne, tx	0	0	0	0	0	0	0	0	0	0	m
0	0	0	0	0	0	0	0	0	0	0	0	what is ca crv?	0	0	0	0	0	0	0	0	0	0	m
0	0	0	0	0	0	0	0	0	0	0	0	how to remove flywheel bolts on 1999 subaru legacy	0	0	0	0	0	0	0	0	0	0	m
0	0	0	0	0	0	0	0	0	0	0	0	what is a demo font?	0	0	0	0	0	0	0	0	0	0	m
0	0	0	0	0	0	0	0	0	0	0	0	is marran a name	0	0	0	0	0	0	0	0	0	0	m
0	0	0	0	0	0	0	0	0	0	0	0	how much time does an adjudicator in small claims court in new brunswick have to make a decision	0	0	0	0	0	0	0	0	0	0	m
1	0	0	0	0	0	0	0	0	0	0	1	best time to visit xiamen	0	0	0	0	0	0	0	0	0	1	m
0	0	0	0	0	0	0	0	0	0	0	1	what are some common ways to relieve stress	0	0	0	0	0	0	0	0	0	0	m
1	0	0	0	0	0	0	0	0	0	0	0	what disease has night sweats as a symptom?	0	0	0	0	0	0	0	0	0	0	m
0	0	0	0	0	0	0	0	0	0	0	0	how do you say galapagos islands	0	0	0	0	0	0	0	0	0	0	m
0	0	0	0	0	0	0	0	0	0	0	0	how does java work	0	0	0	0	0	0	0	0	0	0	m
0	0	0	0	0	0	0	0	0	0	0	0	agitated definition	0	0	0	0	0	0	0	0	0	1	m
0	0	0	0	0	0	0	0	0	0	0	0	what is elss	0	0	0	0	0	0	0	0	0	0	m
0	0	0	0	0	0	0	0	0	0	0	0	is butorphanol a controlled substance	0	0	0	0	0	0	0	0	0	0	m
0	0	0	0	0	0	0	0	0	0	0	0	how long has the tv show big bang theory been on	0	0	0	0	0	0	0	0	0	0	m
0	0	0	0	0	0	0	0	0	0	0	0	average infant size	0	0	0	0	0	0	0	0	0	1	m
0	0	0	0	0	0	0	0	0	0	0	0	waves of nausea causes	0	0	0	0	0	0	0	0	0	1	m
0	0	0	0	0	0	0	0	0	0	0	0	what is the green pigment in plants called?	0	0	0	0	0	0	0	0	0	0	m
0	0	0	0	0	0	0	0	0	0	0	0	flat anvil definition	0	0	0	0	0	0	0	0	0	1	m
0	0	0	0	0	0	0	0	0	0	0	0	what is a factual employment verification	0	0	0	0	0	0	0	0	0	0	m
0	0	0	0	0	0	0	0	0	0	0	0	what is a tooth dry socket	0	0	0	0	0	0	0	0	0	0	m
0	0	0	0	0	0	0	0	0	0	0	0	in the definition of conflict, the idea of incompatible goals means that	0	0	0	0	0	0	0	0	0	1	m
0	0	0	0	0	0	0	0	0	0	0	0	how many mg make a gram	0	0	0	0	0	0	0	0	0	0	m
0	0	0	0	0	0	0	0	0	0	0	0	what is a conclusion to an essay	0	0	0	0	0	0	0	0	0	0	m
0	0	0	0	0	0	0	0	0	0	0	0	what do.you feed llamas in minecraft	0	0	0	0	0	0	0	0	0	0	m
0	0	0	0	0	0	0	0	0	0	0	0	weight limit for checked baggage on delta	0	0	0	0	0	0	0	0	0	0	m
0	0	0	0	0	0	0	0	0	0	0	0	what bulb type is a regalia ceiling fan	0	0	0	0	0	0	0	0	0	0	m
0	0	0	0	0	0	0	0	0	0	0	0	what does vaps stand for	0	0	0	0	0	0	0	0	0	0	m
0	0	0	0	0	0	0	0	0	0	0	0	waterfront properties in northern california	0	0	0	0	0	0	0	0	0	0	m
0	0	0	0	0	0	0	0	0	0	0	0	what is near hotel lord berri montreal qc	0	0	0	0	0	0	0	0	0	0	m
0	0	0	0	0	0	0	0	0	0	0	0	average account director	0	0	0	0	0	0	0	0	0	1	m
0	0	0	0	0	0	0	0	0	0	0	0	what to molecules make skeletal muscle contract	0	0	0	0	0	0	0	0	0	0	m
0	0	0	0	0	0	0	0	0	0	0	0	definition of venous stasis	0	0	0	0	0	0	0	0	0	1	m
0	0	0	0	0	0	0	0	0	0	0	0	can prednisone cause cardiomyopathy or chf	0	0	0	0	0	0	0	0	0	0	m
0	0	0	0	0	0	0	0	0	0	0	0	where is bauma	0	0	0	0	0	0	0	0	0	0	m
0	0	0	0	0	0	0	0	0	0	0	1	Which type of movement is the most complex and is integrated in the cerebral cortex?	0	0	0	0	0	0	0	0	0	0	m
0	0	0	0	0	0	0	0	0	0	0	0	cost sharing in medicine, definition	0	0	0	0	0	0	0	0	0	0	m
0	0	0	0	0	0	0	0	0	0	0	0	can you eat pretzels on a diet	0	0	0	0	0	0	0	0	0	0	m
0	0	0	0	0	0	0	0	0	0	0	0	when can i start peppers in central texas	0	0	0	0	0	0	0	0	0	0	m
0	0	0	0	0	0	0	0	0	0	0	0	where are ironman tires manufactured	0	0	0	0	0	0	0	0	0	0	m
0	0	0	0	0	0	0	0	0	0	0	0	bona fide need rule in contracting	0	0	0	0	0	0	0	0	0	1	m
0	0	0	0	0	0	0	0	0	0	0	0	How long does it usually take for the IRS to audit your tax return	0	0	0	0	0	0	0	0	0	0	m
0	0	0	0	0	0	0	0	0	0	0	0	what is the function of hair	0	0	0	0	0	0	0	0	0	0	m
0	0	0	0	0	0	0	0	0	0	0	0	how long do engineering graduate programs take	0	0	0	0	0	0	0	0	0	0	m
0	0	0	0	0	0	0	0	0	0	0	0	how old is amy grant	0	0	0	0	0	0	0	0	0	0	m
0	0	0	0	0	0	0	0	0	0	0	0	words to catholic song bring the lord your offerings	0	0	0	0	0	0	0	0	0	1	m
0	0	0	0	0	0	0	0	0	0	0	0	what is ctsos	0	0	0	0	0	0	0	0	0	0	m
0	0	0	0	0	0	0	0	0	0	0	0	how do roth ira's help you on taxes	0	0	0	0	0	0	0	0	0	0	m
0	0	0	0	0	0	0	0	0	0	0	1	biggest processing of food	0	0	0	0	0	0	0	0	0	1	m
0	0	0	0	0	0	0	0	0	0	0	0	what are the two major forms of cryptography?	0	0	0	0	0	0	0	0	0	0	m
0	0	0	0	0	0	0	0	0	0	0	1	differences between communicable and non communicable diseases	0	0	0	0	0	0	0	0	0	1	m
0	0	0	0	0	0	0	0	0	0	0	0	macroglossia symptoms	0	0	0	0	0	0	0	0	0	1	m
0	0	0	0	0	0	0	0	0	0	0	0	what serum creatinine level warrants seeing a nephrologist	0	0	0	0	0	0	0	0	0	0	m
0	0	0	0	0	0	0	0	0	0	0	0	what is a butterfinger candy bar made of	0	0	0	0	0	0	0	0	0	0	m
0	0	0	0	0	0	0	0	0	0	0	0	how much prize money does the winner of the rogers cup tennis tournament get	0	0	0	0	0	0	0	0	0	0	m
0	0	0	0	0	0	0	0	0	0	0	0	how to apply resource locks at subscription level	0	0	0	0	0	0	0	0	0	0	m
0	0	0	0	0	0	0	0	0	0	0	0	what's happening in meridian idaho	0	0	0	0	0	0	0	0	0	0	m
0	0	0	0	0	0	0	0	0	0	0	0	is lupus a virus	0	0	0	0	0	0	0	0	0	0	m
0	0	0	0	0	0	0	0	0	0	0	0	what is the average IQ of a high school teacher	0	0	0	0	0	0	0	0	0	0	m
0	0	0	0	0	0	0	0	0	0	0	0	what machinery was used to make luger pistols	0	0	0	0	0	0	0	0	0	0	m
0	0	0	0	0	0	0	0	0	0	0	0	copper skillet cookbook	0	0	0	0	0	0	0	0	0	1	m
0	0	0	0	0	0	0	0	0	0	0	0	how to cook pork shanks in oven	0	0	0	0	0	0	0	0	0	0	m
0	0	0	0	0	0	0	0	0	0	0	0	how much is the cook county senior exemption	0	0	0	0	0	0	0	0	0	0	m
0	0	0	0	0	0	0	0	0	0	0	0	what kind of word is racecar spelled backwards	0	0	0	0	0	0	0	0	0	0	m
0	0	0	0	0	0	0	0	0	0	0	0	where did alstroemeria originate from	0	0	0	0	0	0	0	0	0	0	m
0	0	0	0	0	0	0	0	0	0	0	0	what is an eagle flight?	0	0	0	0	0	0	0	0	0	0	m
0	0	0	0	0	0	0	0	0	0	0	0	how much should a marketing coordinator make	0	0	0	0	0	0	0	0	0	0	m
0	0	0	0	0	0	0	0	0	0	0	0	what county is stanardsville, va in?	0	0	0	0	0	0	0	0	0	0	m
0	0	0	0	0	0	0	0	0	0	0	0	what is a hr playbook	0	0	0	0	0	0	0	0	0	0	m
0	0	0	0	0	0	0	0	0	0	0	0	what movie is in egypt with the brother who has eyes the brother took and hid they fight for the thrown	0	0	0	0	0	0	0	0	0	0	m
0	0	0	0	0	0	0	0	0	0	0	0	define low income cra	0	0	0	0	0	0	0	0	0	0	m
0	0	0	0	0	0	0	0	0	0	0	0	how will the period change if you increase the mass but keep the spring constant the same	0	0	0	0	0	0	0	0	0	0	m
0	0	0	0	0	0	0	0	0	0	0	0	what airports access jackson hole wy	0	0	0	0	0	0	0	0	0	0	m
0	0	0	0	0	0	0	0	0	0	0	0	what is transmantitis	0	0	0	0	0	0	0	0	0	0	m
0	0	0	0	0	0	0	0	0	0	0	0	what does it mean if your tongue swells	0	0	0	0	0	0	0	0	0	0	m
0	0	0	0	0	0	0	0	0	0	0	0	causes of esophageal pain	0	0	0	0	0	0	0	0	0	1	m
0	0	0	0	0	0	0	0	0	0	0	0	Althea Gibson Husband	0	0	0	0	0	0	0	0	0	1	m
0	0	0	0	0	0	0	0	0	0	0	0	what are the greek islands	0	0	0	0	0	0	0	0	0	0	m
0	0	0	0	0	0	0	0	0	0	0	0	where was agnes young born	0	0	0	0	0	0	0	0	0	0	m
0	0	0	0	0	0	0	0	0	0	0	0	what is mdnsresponder	0	0	0	0	0	0	0	0	0	0	m
0	0	0	0	0	0	0	0	0	0	0	0	did elvis sang blue bayou	0	0	0	0	0	0	0	0	0	1	m
0	0	0	0	0	0	0	0	0	0	0	0	is protonix an antacid?	0	0	0	0	0	0	0	0	0	0	m
0	0	0	0	0	0	0	0	0	0	0	0	the name of a popular competitive  business model is	0	0	0	0	0	0	0	0	0	1	m
0	0	0	0	0	0	0	0	0	0	0	0	what does the roman spqr stand for	0	0	0	0	0	0	0	0	0	0	m
0	0	0	0	0	0	0	0	0	0	0	0	what is a good side dish for cilantro lime chicken	0	0	0	0	0	0	0	0	0	0	m
0	0	0	0	0	0	0	0	0	0	0	0	which type of cell are bacteria?	0	0	0	0	0	0	0	0	0	0	m
0	0	0	0	0	0	0	0	0	0	0	0	tschebyscheff array definition	0	0	0	0	0	0	0	0	0	1	m
0	0	0	0	0	0	0	0	0	0	0	0	who plays diane lewis in parks and rec	0	0	0	0	0	0	0	0	0	0	m
0	0	0	0	0	0	0	0	0	0	0	0	when did they started with the car seat	0	0	0	0	0	0	0	0	0	0	m
0	0	0	0	0	0	0	0	0	0	0	0	what sizes do ceramic kitchen knives come in?	0	0	0	0	0	0	0	0	0	0	m
0	0	0	0	0	0	0	0	0	0	0	0	what is holden wv zip	0	0	0	0	0	0	0	0	0	0	m
0	0	0	0	0	0	0	0	0	0	0	0	how much does it cost to put a garbage disposal in	0	0	0	0	0	0	0	0	0	0	m
0	0	0	0	0	0	0	0	0	0	0	0	a mouse is what type of device	0	0	0	0	0	0	0	0	0	0	m
0	0	0	0	0	0	0	0	0	0	0	0	what are padrinos	0	0	0	0	0	0	0	0	0	0	m
0	0	0	0	0	0	0	0	0	0	0	0	how much calories are burnt when dancing	0	0	0	0	0	0	0	0	0	0	m
0	0	0	0	0	0	0	0	0	0	0	1	which muscle below would generate the largest force (most powerful muscle) if stimulated?	0	0	0	0	0	0	0	0	0	0	m
0	0	0	0	0	0	0	0	0	0	0	0	what is epeat qualified	0	0	0	0	0	0	0	0	0	0	m
0	0	0	0	0	0	0	0	0	0	0	0	what is trust fund penalty	0	0	0	0	0	0	0	0	0	0	m
0	0	0	0	0	0	0	0	0	0	0	0	how does an effective price floor lead to inefficient resource allocation	0	0	0	0	0	0	0	0	0	0	m
1	0	0	0	0	0	0	0	0	0	0	0	how to use modern vocation ffxiv	0	0	0	0	0	0	0	0	0	0	m
0	0	0	0	0	0	0	0	0	0	0	1	largest gainers stocks	0	0	0	0	0	0	0	0	0	1	m
0	0	0	0	0	0	0	0	0	0	0	0	what does oprah represent	0	0	0	0	0	0	0	0	0	0	m
0	0	0	0	0	0	0	0	0	0	0	0	what county is temple tx in?	0	0	0	0	0	0	0	0	0	0	m
0	0	0	0	0	0	0	0	0	0	0	1	is it good to use the internet as a research tool	0	0	0	0	0	0	0	0	0	0	m
0	0	0	0	0	0	0	0	0	0	0	0	where was otzi the iceman discovered	0	0	0	0	0	0	0	0	0	0	m
0	0	0	0	0	0	0	0	0	0	0	0	are all facebook accounts being hacked snopes	0	0	0	0	0	0	0	0	0	0	m
0	0	0	0	0	0	0	0	0	0	0	1	positive effects of fast food	0	0	0	0	0	0	0	0	0	1	m
0	0	0	0	0	0	0	0	0	0	0	1	what is best grass for cattle	0	0	0	0	0	0	0	0	0	0	m
0	0	0	0	0	0	0	0	0	0	0	0	what do life insurance urine test look for	0	0	0	0	0	0	0	0	0	0	m
0	0	0	0	0	0	0	0	0	0	0	0	flatiron definition	0	0	0	0	0	0	0	0	0	1	m
0	0	0	0	0	0	0	0	0	0	0	0	describe buck's qualities as the new team leader. how is he similar to spitz? how is he different	0	0	0	0	0	0	0	0	0	1	m
0	0	0	0	0	0	0	0	0	0	0	0	seema na song meaning	0	0	0	0	0	0	0	0	0	1	m
0	0	0	0	0	0	0	0	0	0	0	0	can you vent dryer through drain vent	0	0	0	0	0	0	0	0	0	0	m
0	0	0	0	0	0	0	0	0	0	0	1	what type of birth control pill is good for me	0	0	0	0	0	0	0	0	0	0	m
0	0	0	0	0	0	0	0	0	0	0	0	what is importance of rem sleep mode	0	0	0	0	0	0	0	0	0	0	m
1	0	0	0	0	0	0	0	0	0	0	1	what causes finger contractures	0	0	0	0	0	0	0	0	0	0	m
0	0	0	0	0	0	0	0	0	0	0	0	how much will a tax defense attorney charge?	0	0	0	0	0	0	0	0	0	0	m
0	0	0	0	0	0	0	0	0	0	0	0	static enthalpy definition	0	0	0	0	0	0	0	0	0	1	m
0	0	0	0	0	0	0	0	0	0	0	0	what is environmental engineer	0	0	0	0	0	0	0	0	0	0	m
0	0	0	0	0	0	0	0	0	0	0	0	define backbone	0	0	0	0	0	0	0	0	0	1	m
0	0	0	0	0	0	0	0	0	0	0	0	what is hydrotherapy physiotherapy	0	0	0	0	0	0	0	0	0	0	m
0	0	0	0	0	0	0	0	0	0	0	0	what is the definition of prepaid access products	0	0	0	0	0	0	0	0	0	0	m
0	0	0	0	0	0	0	0	0	0	0	0	today, most managers perform some functions associated with ______________.	0	0	0	0	0	0	0	0	0	1	m
0	0	0	0	0	0	0	0	0	0	0	0	when was wine created	0	0	0	0	0	0	0	0	0	0	m
0	0	0	0	0	0	0	0	0	0	0	0	Once a bottle is opened, the human factor can cause	0	0	0	0	0	0	0	0	0	1	m
0	0	0	0	0	0	0	0	0	0	0	0	what type of service is reporting	0	0	0	0	0	0	0	0	0	0	m
0	0	0	0	0	0	0	0	0	0	0	0	what does it mean by credit expense	0	0	0	0	0	0	0	0	0	0	m
0	0	0	0	0	0	0	0	0	0	0	0	do I need the epp code to transfer a domain?	0	0	0	0	0	0	0	0	0	0	m
0	0	0	0	0	0	0	0	0	0	0	0	how old is the youtuber miller wilson	0	0	0	0	0	0	0	0	0	0	m
0	0	0	0	0	0	0	0	0	0	0	0	what is gfsza laws	0	0	0	0	0	0	0	0	0	0	m
0	0	0	0	0	0	0	0	0	0	0	0	what is opportunity qualification process	0	0	0	0	0	0	0	0	0	0	m
0	0	0	0	0	0	0	0	0	0	0	0	what causes ovaries to swell	0	0	0	0	0	0	0	0	0	0	m
0	0	0	0	0	0	0	0	0	0	0	0	who is considered a direct descendant	0	0	0	0	0	0	0	0	0	0	m
0	0	0	0	0	0	0	0	0	0	0	0	what is a oi administrator	0	0	0	0	0	0	0	0	0	0	m
0	0	0	0	0	0	0	0	0	0	0	0	how long wait to replace furniture after rug cleaning	0	0	0	0	0	0	0	0	0	0	m
0	0	0	0	0	0	0	0	0	0	0	0	can the material used to make eyeglass lenses	0	0	0	0	0	0	0	0	0	0	m
0	0	0	0	0	0	0	0	0	0	0	0	what is oily diarrhea	0	0	0	0	0	0	0	0	0	0	m
0	0	0	0	0	0	0	0	0	0	0	0	is ounce a measure of weight or volume	0	0	0	0	0	0	0	0	0	0	m
0	0	0	0	0	0	0	0	0	0	0	0	how many oscars clint	0	0	0	0	0	0	0	0	0	0	m
1	0	0	0	0	0	0	0	0	0	0	0	why is sls bad	0	0	0	0	0	0	0	0	0	0	m
0	0	0	0	0	0	0	0	0	0	0	0	what is an amendment when you buy a house	0	0	0	0	0	0	0	0	0	0	m
0	0	0	0	0	0	0	0	0	0	0	0	main symptoms of lyme disease	0	0	0	0	0	0	0	0	0	0	m
0	0	0	0	0	0	0	0	0	0	0	0	how long can a home outside party last for?	0	0	0	0	0	0	0	0	0	0	m
0	0	0	0	0	0	0	0	0	0	0	1	what are the healthiest food sources rich in vitamin d	0	0	0	0	0	0	0	0	0	0	m
0	0	0	0	0	0	0	0	0	0	0	0	direct care nursing definition	0	0	0	0	0	0	0	0	0	1	m
0	0	0	0	0	0	0	0	0	0	0	0	salary of family day care	0	0	0	0	0	0	0	0	0	1	m
0	0	0	0	0	0	0	0	0	0	0	0	at what age can you work at mcdonalds	0	0	0	0	0	0	0	0	0	0	m
0	0	0	0	0	0	0	0	0	0	0	0	can drinking ensure cause constipation	0	0	0	0	0	0	0	0	0	0	m
0	0	0	0	0	0	0	0	0	0	0	0	What is the meaning of Bonnie	0	0	0	0	0	0	0	0	0	0	m
1	0	0	0	0	0	0	0	0	0	0	0	where should your belly button be located?	0	0	0	0	0	0	0	0	0	0	m
0	0	0	0	0	0	0	0	0	0	0	0	where is shibuya train station	0	0	0	0	0	0	0	0	0	0	m
0	0	0	0	0	0	0	0	0	0	0	0	can a company remove a late payment from credit report	0	0	0	0	0	0	0	0	0	0	m
0	0	0	0	0	0	0	0	0	0	0	0	when did colorado become a state	0	0	0	0	0	0	0	0	0	0	m
0	0	0	0	0	0	0	0	0	0	0	0	who sang every rose has a thorn first	0	0	0	0	0	0	0	0	0	0	m
0	0	0	0	0	0	0	0	0	0	0	0	the diagnostic term arrhythmia means	0	0	0	0	0	0	0	0	0	0	m
0	0	0	0	0	0	0	0	0	0	0	0	how many water molecules will be removed to form ats	0	0	0	0	0	0	0	0	0	0	m
0	0	0	0	0	0	0	0	0	0	0	0	when does cooly rocks start	0	0	0	0	0	0	0	0	0	0	m
1	0	0	0	0	0	0	0	0	0	0	1	what is virtual reality and simulation	0	0	0	0	0	0	0	0	0	0	m
0	0	0	0	0	0	0	0	0	0	0	0	what do serum contain	0	0	0	0	0	0	0	0	0	0	m
0	0	0	0	0	0	0	0	0	0	0	0	when can a pregnancy test be taken after conception	0	0	0	0	0	0	0	0	0	0	m
0	0	0	0	0	0	0	0	0	0	0	0	what are the basic function of a computer	0	0	0	0	0	0	0	0	0	0	m
0	0	0	0	0	0	0	0	0	0	0	0	what is appdata	0	0	0	0	0	0	0	0	0	0	m
0	0	0	0	0	0	0	0	0	0	0	0	client will block traffic from ip address	0	0	0	0	0	0	0	0	0	1	m
0	0	0	0	0	0	0	0	0	0	0	0	how many beds are required in a hospital	0	0	0	0	0	0	0	0	0	0	m
0	0	0	0	0	0	0	0	0	0	0	0	when was the city of dallas founded	0	0	0	0	0	0	0	0	0	0	m
0	0	0	0	0	0	0	0	0	0	0	0	star wars galaxy of heroes what skill is fire at will	0	0	0	0	0	0	0	0	0	0	m
0	0	0	0	0	0	0	0	0	0	0	1	hemp benefits and side effects for dogs	0	0	0	0	0	0	0	0	0	1	m
0	0	0	0	0	0	0	0	0	0	0	0	systane night time gel long term use	0	0	0	0	0	0	0	0	0	1	m
1	0	0	0	0	0	0	0	0	0	0	1	what vegetables is on veggietales	0	0	0	0	0	0	0	0	0	0	m
0	0	0	0	0	0	0	0	0	0	0	0	how long does it take for nicotine to leave your cheek cells	0	0	0	0	0	0	0	0	0	0	m
0	0	0	0	0	0	0	0	0	0	0	0	what is hidebound reimbursement system	0	0	0	0	0	0	0	0	0	0	m
0	0	0	0	0	0	0	0	0	0	0	0	do ashwagandha tablets helps anxiety	0	0	0	0	0	0	0	0	0	0	m
0	0	0	0	0	0	0	0	0	0	0	0	does mineral oil work for constipation	0	0	0	0	0	0	0	0	0	0	m
0	0	0	0	0	0	0	0	0	0	0	0	the senate is responsible for___	0	0	0	0	0	0	0	0	0	1	m
0	0	0	0	0	0	0	0	0	0	0	1	what's the most popular chocolate in europe	0	0	0	0	0	0	0	0	0	0	m
1	0	0	0	0	0	0	0	0	0	0	1	medications that cause yellow teeth	0	0	0	0	0	0	0	0	0	0	m
0	0	0	0	0	0	0	0	0	0	0	0	meaning of axis in eyeglasses prescription	0	0	0	0	0	0	0	0	0	1	m
0	0	0	0	0	0	0	0	0	0	0	0	common causes for lower gi bleeding in young adults	0	0	0	0	0	0	0	0	0	1	m
0	0	0	0	0	0	0	0	0	0	0	0	half price skating belmar	0	0	0	0	0	0	0	0	0	1	m
0	0	0	0	0	0	0	0	0	0	0	0	do female goats bleed after giving birth	0	0	0	0	0	0	0	0	0	0	m
0	0	0	0	0	0	0	0	0	0	0	0	what is the acronym scif means?	0	0	0	0	0	0	0	0	0	0	m
